{
  "name": "the session does not time out while in the foreground",
  "options": {"flushIntervalMs": 86400000},
  "steps": [
    {"op": "track", "name": "A"},
    {"op": "advance", "ms": 600000},
    {"op": "track", "name": "B"},
    {"op": "flush"}
  ],
  "expect": {
    "requests": [
      {
        "$partial": true,
        "events": [
          {
            "$partial": true,
            "name": "A",
            "sessionId": 1767225600000
          },
          {
            "$partial": true,
            "name": "B",
            "sessionId": 1767225600000
          }
        ]
      }
    ]
  }
}
