{
  "name": "a batch is split to keep its body under the 900 KB cap",
  "options": {"flushQueueSize": 100},
  "steps": [
    {"op": "track", "name": "Big", "fill": {"key": "S", "count": 30000}},
    {"op": "track", "name": "Big", "fill": {"key": "S", "count": 30000}},
    {"op": "track", "name": "Big", "fill": {"key": "S", "count": 30000}},
    {"op": "track", "name": "Big", "fill": {"key": "S", "count": 30000}},
    {"op": "track", "name": "Big", "fill": {"key": "S", "count": 30000}},
    {"op": "track", "name": "Big", "fill": {"key": "S", "count": 30000}},
    {"op": "track", "name": "Big", "fill": {"key": "S", "count": 30000}},
    {"op": "track", "name": "Big", "fill": {"key": "S", "count": 30000}},
    {"op": "track", "name": "Big", "fill": {"key": "S", "count": 30000}},
    {"op": "track", "name": "Big", "fill": {"key": "S", "count": 30000}},
    {"op": "track", "name": "Big", "fill": {"key": "S", "count": 30000}},
    {"op": "track", "name": "Big", "fill": {"key": "S", "count": 30000}},
    {"op": "track", "name": "Big", "fill": {"key": "S", "count": 30000}},
    {"op": "track", "name": "Big", "fill": {"key": "S", "count": 30000}},
    {"op": "track", "name": "Big", "fill": {"key": "S", "count": 30000}},
    {"op": "track", "name": "Big", "fill": {"key": "S", "count": 30000}},
    {"op": "track", "name": "Big", "fill": {"key": "S", "count": 30000}},
    {"op": "track", "name": "Big", "fill": {"key": "S", "count": 30000}},
    {"op": "track", "name": "Big", "fill": {"key": "S", "count": 30000}},
    {"op": "track", "name": "Big", "fill": {"key": "S", "count": 30000}},
    {"op": "track", "name": "Big", "fill": {"key": "S", "count": 30000}},
    {"op": "track", "name": "Big", "fill": {"key": "S", "count": 30000}},
    {"op": "track", "name": "Big", "fill": {"key": "S", "count": 30000}},
    {"op": "track", "name": "Big", "fill": {"key": "S", "count": 30000}},
    {"op": "track", "name": "Big", "fill": {"key": "S", "count": 30000}},
    {"op": "track", "name": "Big", "fill": {"key": "S", "count": 30000}},
    {"op": "track", "name": "Big", "fill": {"key": "S", "count": 30000}},
    {"op": "track", "name": "Big", "fill": {"key": "S", "count": 30000}},
    {"op": "track", "name": "Big", "fill": {"key": "S", "count": 30000}},
    {"op": "track", "name": "Big", "fill": {"key": "S", "count": 30000}},
    {"op": "track", "name": "Big", "fill": {"key": "S", "count": 30000}},
    {"op": "flush"}
  ],
  "expect": {
    "requests": [
      {
        "$partial": true,
        "events": [
          "<any>",
          "<any>",
          "<any>",
          "<any>",
          "<any>",
          "<any>",
          "<any>",
          "<any>",
          "<any>",
          "<any>",
          "<any>",
          "<any>",
          "<any>",
          "<any>",
          "<any>",
          "<any>",
          "<any>",
          "<any>",
          "<any>",
          "<any>",
          "<any>",
          "<any>",
          "<any>",
          "<any>",
          "<any>",
          "<any>",
          "<any>",
          "<any>",
          "<any>",
          "<any>"
        ]
      },
      {"$partial": true, "events": ["<any>"]}
    ],
    "queueLength": 0
  }
}
